{
  "$schema": "./ai-route-policy.schema.json",
  "policyVersion": "2026-08-04.2",
  "employeeDataEgressEnabled": false,
  "model": "qwen/qwen3-235b-a22b-2507",
  "providerTag": "google-vertex/us-south1",
  "providerMetadataName": "Google",
  "requirements": {
    "zeroDataRetention": true,
    "structuredOutputs": true,
    "responseFormat": true,
    "allowFallbacks": false,
    "dataCollection": "deny",
    "cache": false,
    "implicitCaching": false,
    "bringYourOwnKeys": false,
    "managementControlPlanePreflight": true,
    "syntheticRouteProbe": true,
    "plugins": false,
    "webSearch": false,
    "tools": false
  },
  "priceCeilingsUsdPerMillionTokens": {
    "prompt": 0.25,
    "completion": 1
  }
}
